{
  "$schema": "https://json-schema.org/draft/2020-12/schema",
  "$id": "https://eclipse.dev/basyx/studio/schemas/app-manifest-0.json",
  "title": "BaSyx Studio app manifest, version 0",
  "description": "studio-app.json at the root of an app package. Paths are relative to the package root.",
  "type": "object",
  "additionalProperties": false,
  "required": ["manifestVersion", "id", "version", "publisher", "title", "studioApi", "runtimes", "permissions", "contributes"],
  "properties": {
    "$schema": { "type": "string", "maxLength": 512 },
    "manifestVersion": { "const": 0 },
    "id": {
      "description": "Reverse-DNS app ID, e.g. org.example.nameplate.",
      "type": "string",
      "maxLength": 128,
      "pattern": "^[a-z][a-z0-9-]*(\\.[a-z][a-z0-9-]*){1,9}$"
    },
    "version": {
      "description": "Semantic version of this app package.",
      "type": "string",
      "maxLength": 64,
      "pattern": "^(0|[1-9]\\d*)\\.(0|[1-9]\\d*)\\.(0|[1-9]\\d*)(-[0-9A-Za-z.-]+)?(\\+[0-9A-Za-z.-]+)?$"
    },
    "publisher": {
      "type": "object",
      "additionalProperties": false,
      "required": ["name"],
      "properties": {
        "name": { "type": "string", "minLength": 1, "maxLength": 128 },
        "url": { "type": "string", "format": "uri", "pattern": "^https://", "maxLength": 512 }
      }
    },
    "title": { "$ref": "#/$defs/localizedLabel" },
    "description": { "$ref": "#/$defs/localizedText" },
    "studioApi": {
      "description": "Semantic version range of the Studio app API the app works with, e.g. ^0.1.0.",
      "type": "string",
      "minLength": 1,
      "maxLength": 64
    },
    "runtimes": {
      "type": "array",
      "minItems": 1,
      "uniqueItems": true,
      "items": { "enum": ["hosted", "desktop"] }
    },
    "permissions": {
      "description": "What the app may do. An administrator approves these at install; every call is additionally limited by the user's own rights.",
      "type": "array",
      "uniqueItems": true,
      "items": { "enum": ["studio.aas.read", "studio.aas.write", "studio.ui.notifications", "studio.ui.navigation", "studio.ui.clipboard", "studio.ui.externalFiles", "studio.backend", "studio.containers", "studio.timeseries.read", "studio.connections"] }
    },
    "backend": {
      "description": "Server-side code, run in an isolated Deno process. Requires the studio.backend permission.",
      "type": "object",
      "additionalProperties": false,
      "required": ["runtime", "entry"],
      "properties": {
        "runtime": { "const": "deno" },
        "entry": { "$ref": "#/$defs/scriptPath" }
      }
    },
    "sandbox": {
      "description": "What the app's pages may run and reach beyond their own files. An administrator sees all of it at install. The origin lists need Studio app API 0.1.3.",
      "type": "object",
      "additionalProperties": false,
      "properties": {
        "webAssembly": { "description": "Compile and run WebAssembly modules, e.g. file parsers.", "type": "boolean" },
        "workers": { "description": "Start dedicated workers from blob: URLs, e.g. to parse large files off the page.", "type": "boolean" },
        "frameOrigins": { "description": "Origins of pages the app embeds in frames (CSP frame-src).", "$ref": "#/$defs/origins" },
        "connectOrigins": { "description": "Origins of keyless public APIs the app reads with fetch (CSP connect-src). Together with webAssembly or workers, only for publishers the trust store grants remoteCode.", "$ref": "#/$defs/origins" },
        "imageOrigins": { "description": "Origins of images the app shows, e.g. map tiles (CSP img-src).", "$ref": "#/$defs/origins" },
        "mediaOrigins": { "description": "Origins of audio and video the app plays (CSP media-src).", "$ref": "#/$defs/origins" }
      }
    },
    "connections": {
      "description": "HTTP services the app calls through Studio with studio.connections.call, each described by an OpenAPI document in the package. An administrator binds each to a connection of an infrastructure, which holds the URL and the credentials. Requires the studio.connections permission and Studio app API 0.1.6.",
      "type": "array",
      "maxItems": 16,
      "items": { "$ref": "#/$defs/connection" }
    },
    "contributes": {
      "type": "object",
      "additionalProperties": false,
      "properties": {
        "submodelViews": {
          "type": "array",
          "maxItems": 32,
          "items": { "$ref": "#/$defs/submodelView" }
        },
        "modules": {
          "type": "array",
          "maxItems": 16,
          "items": { "$ref": "#/$defs/module" }
        }
      }
    }
  },
  "$defs": {
    "localizedLabel": {
      "description": "Text per BCP 47 language tag, e.g. { \"en\": \"Nameplate\" }.",
      "type": "object",
      "minProperties": 1,
      "maxProperties": 32,
      "propertyNames": { "pattern": "^[a-z]{2,3}(-[A-Za-z0-9]{2,8})*$" },
      "additionalProperties": { "type": "string", "minLength": 1, "maxLength": 80 }
    },
    "localizedText": {
      "type": "object",
      "minProperties": 1,
      "maxProperties": 32,
      "propertyNames": { "pattern": "^[a-z]{2,3}(-[A-Za-z0-9]{2,8})*$" },
      "additionalProperties": { "type": "string", "minLength": 1, "maxLength": 1000 }
    },
    "connection": {
      "type": "object",
      "additionalProperties": false,
      "required": ["id", "title", "api", "operations"],
      "properties": {
        "id": { "description": "Named in studio.connections.call and in the administrator's binding.", "type": "string", "pattern": "^[a-z0-9][a-z0-9-]{0,62}$" },
        "title": { "$ref": "#/$defs/localizedLabel" },
        "description": { "$ref": "#/$defs/localizedText" },
        "api": {
          "description": "Package-relative path of an OpenAPI 3.0 or 3.1 document in JSON. Its servers and security are ignored: the administrator's connection gives the URL and the credentials.",
          "type": "string",
          "maxLength": 512,
          "pattern": "^[A-Za-z0-9_-][A-Za-z0-9._/-]*\\.json$"
        },
        "operations": {
          "description": "The operationIds of the document that the app calls. Other operations stay unreachable.",
          "type": "array",
          "minItems": 1,
          "maxItems": 200,
          "uniqueItems": true,
          "items": { "type": "string", "minLength": 1, "maxLength": 200 }
        }
      }
    },
    "contributionId": { "type": "string", "pattern": "^[a-z][a-z0-9-]{0,63}$" },
    "htmlPath": {
      "description": "Package-relative path of an HTML document.",
      "type": "string",
      "maxLength": 512,
      "pattern": "^[A-Za-z0-9_-][A-Za-z0-9._/-]*\\.html$"
    },
    "scriptPath": {
      "description": "Package-relative path of an ES module.",
      "type": "string",
      "maxLength": 512,
      "pattern": "^[A-Za-z0-9_-][A-Za-z0-9._/-]*\\.(js|mjs)$"
    },
    "submodelView": {
      "description": "A view offered next to the generic element tree for submodels with one of the semantic IDs (exact match).",
      "type": "object",
      "additionalProperties": false,
      "required": ["id", "title", "entry", "semanticIds"],
      "properties": {
        "id": { "$ref": "#/$defs/contributionId" },
        "title": { "$ref": "#/$defs/localizedLabel" },
        "entry": { "$ref": "#/$defs/htmlPath" },
        "semanticIds": {
          "type": "array",
          "minItems": 1,
          "maxItems": 64,
          "uniqueItems": true,
          "items": { "type": "string", "minLength": 1, "maxLength": 2048 }
        },
        "columns": {
          "description": "Default width as a widget on a shell's Overview, in columns of 12, per breakpoint of the Overview's width (Vuetify's names, as in v-col). A breakpoint without a value uses the nearest smaller one; without any, the view starts half wide from lg and full width below.",
          "type": "object",
          "additionalProperties": false,
          "properties": {
            "xs": { "$ref": "#/$defs/columns" },
            "sm": { "$ref": "#/$defs/columns" },
            "md": { "$ref": "#/$defs/columns" },
            "lg": { "$ref": "#/$defs/columns" },
            "xl": { "$ref": "#/$defs/columns" },
            "xxl": { "$ref": "#/$defs/columns" }
          }
        }
      }
    },
    "columns": { "type": "integer", "minimum": 3, "maximum": 12 },
    "origins": {
      "type": "array",
      "maxItems": 16,
      "uniqueItems": true,
      "items": {
        "description": "An origin in lower case: https://host[:port], where the host may start with one *. label followed by at least two labels (https://*.example.org), or http:// for loopback hosts (localhost, names below .localhost, 127.0.0.1) during development. IPv6 literals are not accepted: a Content Security Policy cannot name them.",
        "type": "string",
        "maxLength": 300,
        "pattern": "^(https://(\\*\\.)?([a-z0-9]([a-z0-9-]{0,61}[a-z0-9])?\\.)+[a-z0-9]([a-z0-9-]{0,61}[a-z0-9])?|http://(localhost|([a-z0-9]([a-z0-9-]{0,61}[a-z0-9])?\\.)+localhost|127\\.0\\.0\\.1))(:[1-9][0-9]{0,4})?$"
      }
    },
    "module": {
      "description": "A page with its own route and navigation entry. context: global (always), target (a target is open), shell (a shell is selected).",
      "type": "object",
      "additionalProperties": false,
      "required": ["id", "title", "entry", "route", "context"],
      "properties": {
        "id": { "$ref": "#/$defs/contributionId" },
        "title": { "$ref": "#/$defs/localizedLabel" },
        "icon": { "type": "string", "pattern": "^mdi-[a-z0-9-]{1,64}$" },
        "entry": { "$ref": "#/$defs/htmlPath" },
        "route": { "type": "string", "pattern": "^[a-z][a-z0-9-]{0,63}$" },
        "context": { "enum": ["global", "target", "shell"] },
        "layout": {
          "description": "standard (default): in a card below a header with breadcrumbs. fullPage: the frame fills the page from the navigation rail to the window's edges, without header, card or padding. Needs Studio app API 0.1.3.",
          "enum": ["standard", "fullPage"]
        }
      }
    }
  }
}
